[
  {
    "id": 1,
    "title": "Draft: Q4 Earnings Analysis",
    "status": "draft",
    "created_at": "2025-01-15T10:00:00Z",
    "updated_at": "2025-01-15T14:30:00Z",
    "word_count": 450,
    "source_article_id": null,
    "preview": "This draft analyzes the Q4 earnings reports from major tech companies..."
  },
  {
    "id": 2,
    "title": "Draft: Market Trends Report",
    "status": "review",
    "created_at": "2025-01-14T09:00:00Z",
    "updated_at": "2025-01-15T11:00:00Z",
    "word_count": 680,
    "source_article_id": 1,
    "preview": "An in-depth look at current market trends and their implications..."
  },
  {
    "id": 3,
    "title": "Draft: Financial Sector Analysis",
    "status": "ready",
    "created_at": "2025-01-13T08:00:00Z",
    "updated_at": "2025-01-14T16:00:00Z",
    "word_count": 520,
    "source_article_id": null,
    "preview": "Comprehensive analysis of the financial sector performance..."
  }
]